{
  "contractVersion": "xonovex.workflow.work-record/v1",
  "self": {
    "kind": "workflow-work-record",
    "intent": "write",
    "writeMode": "update",
    "locator": {
      "provider": "incident-system",
      "reference": "INC-204/workflow",
      "revision": "8",
      "expectedRevision": "8"
    }
  },
  "state": "active",
  "root": {
    "kind": "incident",
    "intent": "read",
    "locator": {
      "provider": "incident-system",
      "reference": "INC-204",
      "revision": "23"
    }
  },
  "inputs": {
    "signals": {
      "kind": "telemetry-snapshot",
      "intent": "read",
      "locator": {
        "provider": "observability",
        "reference": "INC-204/signals",
        "revision": "snapshot-17"
      }
    }
  },
  "perspectives": [
    {
      "value": "customer-impact",
      "provenance": {
        "source": "policy",
        "reason": "Incident policy requires customer-impact evidence."
      },
      "questions": ["Which users and transactions are affected?"],
      "criterionIds": [],
      "evidenceRequirements": ["Use the exact telemetry snapshot."]
    }
  ],
  "criteria": [
    {
      "id": "service-recovery",
      "statement": "User-impact indicators recover for the exact mitigation revision.",
      "binding": "binding",
      "provenance": {
        "source": "policy",
        "reason": "Incident policy requires observed recovery."
      },
      "evaluation": "not-evaluated"
    }
  ],
  "skills": [
    {
      "guide": "workflow-guide",
      "plugin": "xonovex-skill-workflow",
      "implementationVersion": "7.0.0",
      "packagePath": "packages/skill/skill-workflow",
      "sourcesPath": "packages/skill/skill-workflow/workflow-guide/SOURCES.md",
      "provenance": {
        "kind": "policy",
        "reason": "Incident policy selects composable workflow operations.",
        "requestedBy": "incident-policy"
      },
      "provenances": [
        {
          "kind": "policy",
          "reason": "Incident policy selects composable workflow operations.",
          "requestedBy": "incident-policy"
        }
      ],
      "matchedProvisions": [
        {
          "provision": {
            "id": "procedure:workflow-operation",
            "version": "1.0.0"
          },
          "requestedRange": "^1.0.0"
        }
      ],
      "provision": {
        "id": "procedure:workflow-operation",
        "version": "1.0.0"
      },
      "requestedRange": "^1.0.0",
      "catalogContractVersion": "2.0.0",
      "catalogDigest": "6e81f31982a6f34cf0d43a16b0a3c26c31192dca77ecc7a88b274b1e42e9b00c",
      "reason": "Owns each operation contract in the graph.",
      "reasons": ["Owns each operation contract in the graph."],
      "required": true,
      "status": "selected"
    }
  ],
  "overlays": {
    "applied": [],
    "conflicts": [],
    "failures": [],
    "shadowed": [],
    "skipped": []
  },
  "checkpoints": [],
  "plan": {
    "nodes": [
      {
        "id": "review-signals",
        "operation": "review",
        "state": "ready",
        "required": true,
        "request": {
          "kind": "workflow-request",
          "intent": "read",
          "locator": {
            "provider": "incident-system",
            "reference": "INC-204/requests/review-signals",
            "revision": "1"
          }
        }
      },
      {
        "id": "execute-mitigation",
        "operation": "execute",
        "state": "ready",
        "required": true,
        "request": {
          "kind": "workflow-request",
          "intent": "read",
          "locator": {
            "provider": "incident-system",
            "reference": "INC-204/requests/execute-mitigation",
            "revision": "2"
          }
        }
      },
      {
        "id": "validate-recovery",
        "operation": "validate",
        "state": "pending",
        "required": true,
        "request": {
          "kind": "workflow-request",
          "intent": "read",
          "locator": {
            "provider": "incident-system",
            "reference": "INC-204/requests/validate-recovery",
            "revision": "1"
          }
        }
      },
      {
        "id": "review-impact",
        "operation": "review",
        "state": "pending",
        "required": true,
        "request": {
          "kind": "workflow-request",
          "intent": "read",
          "locator": {
            "provider": "incident-system",
            "reference": "INC-204/requests/review-impact",
            "revision": "1"
          }
        }
      },
      {
        "id": "create-followups",
        "operation": "create",
        "state": "pending",
        "required": false,
        "request": {
          "kind": "workflow-request",
          "intent": "read",
          "locator": {
            "provider": "incident-system",
            "reference": "INC-204/requests/create-followups",
            "revision": "1"
          }
        }
      }
    ],
    "edges": [
      {
        "from": "execute-mitigation",
        "to": "validate-recovery",
        "condition": "completed",
        "bindings": [
          {
            "source": "effects",
            "target": "inputs.mitigation"
          }
        ]
      },
      {
        "from": "review-signals",
        "to": "review-impact",
        "condition": "completed",
        "bindings": [
          {
            "source": "output",
            "target": "inputs.initial-review"
          }
        ]
      },
      {
        "from": "validate-recovery",
        "to": "review-impact",
        "condition": "completed",
        "bindings": [
          {
            "source": "output",
            "target": "inputs.recovery-evidence"
          }
        ]
      },
      {
        "from": "review-impact",
        "to": "create-followups",
        "condition": "completed",
        "bindings": [
          {
            "source": "output",
            "target": "subject"
          }
        ]
      }
    ]
  },
  "children": [],
  "unresolved": [],
  "retry": {
    "safe": true,
    "boundary": "Review-signals and execute-mitigation may start in parallel.",
    "reconcileBeforeRetry": false
  },
  "expectedRevision": "8",
  "updatedAt": "2026-07-23T12:00:00Z"
}
