{
  "contractVersion": "xonovex.workflow.work-record/v1",
  "self": {
    "kind": "workflow-work-record",
    "intent": "write",
    "writeMode": "update",
    "locator": {
      "provider": "tracker",
      "reference": "CHANGE-19/workflow",
      "revision": "4",
      "expectedRevision": "4"
    }
  },
  "state": "active",
  "root": {
    "kind": "change-request",
    "intent": "read",
    "locator": {
      "provider": "tracker",
      "reference": "CHANGE-19",
      "revision": "6"
    }
  },
  "inputs": {
    "workspace": {
      "kind": "workspace",
      "intent": "read",
      "locator": {
        "provider": "git",
        "reference": "worktree/change-19",
        "revision": "base-a81f"
      }
    }
  },
  "perspectives": [],
  "criteria": [
    {
      "id": "targeted-checks",
      "statement": "The targeted checks pass for the exact workspace revision.",
      "binding": "binding",
      "provenance": {
        "source": "policy",
        "reason": "The small-change policy requires targeted validation."
      },
      "evaluation": "not-evaluated"
    }
  ],
  "skills": [
    {
      "guide": "workflow-guide",
      "plugin": "xonovex-skill-workflow",
      "implementationVersion": "7.0.0",
      "packagePath": "packages/skill/skill-workflow",
      "sourcesPath": "packages/skill/skill-workflow/workflow-guide/SOURCES.md",
      "provenance": {
        "kind": "semantic-requirement",
        "reason": "The graph requires composable workflow operations.",
        "requestedBy": "work-record:CHANGE-19/workflow"
      },
      "provenances": [
        {
          "kind": "semantic-requirement",
          "reason": "The graph requires composable workflow operations.",
          "requestedBy": "work-record:CHANGE-19/workflow"
        }
      ],
      "matchedProvisions": [
        {
          "provision": {
            "id": "procedure:workflow-operation",
            "version": "1.0.0"
          },
          "requestedRange": "^1.0.0"
        }
      ],
      "provision": {
        "id": "procedure:workflow-operation",
        "version": "1.0.0"
      },
      "requestedRange": "^1.0.0",
      "catalogContractVersion": "2.0.0",
      "catalogDigest": "6e81f31982a6f34cf0d43a16b0a3c26c31192dca77ecc7a88b274b1e42e9b00c",
      "reason": "Owns each operation contract in the graph.",
      "reasons": ["Owns each operation contract in the graph."],
      "required": true,
      "status": "selected"
    }
  ],
  "overlays": {
    "applied": [],
    "conflicts": [],
    "failures": [],
    "shadowed": [],
    "skipped": []
  },
  "checkpoints": [],
  "plan": {
    "nodes": [
      {
        "id": "execute-change",
        "operation": "execute",
        "state": "ready",
        "required": true,
        "request": {
          "kind": "workflow-request",
          "intent": "read",
          "locator": {
            "provider": "tracker",
            "reference": "CHANGE-19/requests/execute",
            "revision": "1"
          }
        }
      },
      {
        "id": "validate-change",
        "operation": "validate",
        "state": "pending",
        "required": true,
        "request": {
          "kind": "workflow-request",
          "intent": "read",
          "locator": {
            "provider": "tracker",
            "reference": "CHANGE-19/requests/validate",
            "revision": "1"
          }
        }
      },
      {
        "id": "merge-workspace",
        "operation": "workspace-merge",
        "state": "pending",
        "required": true,
        "request": {
          "kind": "workflow-request",
          "intent": "read",
          "locator": {
            "provider": "tracker",
            "reference": "CHANGE-19/requests/merge",
            "revision": "1"
          }
        }
      }
    ],
    "edges": [
      {
        "from": "execute-change",
        "to": "validate-change",
        "condition": "completed",
        "bindings": [
          {
            "source": "output",
            "target": "inputs.execution"
          }
        ]
      },
      {
        "from": "validate-change",
        "to": "merge-workspace",
        "condition": "completed",
        "bindings": [
          {
            "source": "output",
            "target": "inputs.validation"
          }
        ]
      }
    ]
  },
  "children": [],
  "unresolved": [],
  "retry": {
    "safe": true,
    "boundary": "Start at execute-change; no graph effects have been applied.",
    "reconcileBeforeRetry": false
  },
  "expectedRevision": "4",
  "updatedAt": "2026-07-23T12:00:00Z"
}
